{
  "$schema": "https://json-schema.org/draft/2020-12/schema",
  "$id": "https://labrith.example.com/schemas/proof.schema.json",
  "title": "Proof-of-Work Record",
  "description": "Every agent output must carry this record. See Design Doc Section 6.",
  "type": "object",
  "required": ["agent", "task_id", "claim", "evidence", "reasoning", "timestamp"],
  "properties": {
    "agent": {
      "type": "string",
      "enum": ["planner", "designer", "engineer", "integration", "qa", "critic"],
      "description": "The agent that produced this proof."
    },
    "task_id": {
      "type": "string",
      "minLength": 1,
      "description": "Identifier of the task this proof relates to."
    },
    "claim": {
      "type": "string",
      "minLength": 1,
      "description": "What the agent claims to have done."
    },
    "evidence": {
      "type": "array",
      "minItems": 1,
      "items": {
        "type": "object",
        "required": ["type", "ref"],
        "properties": {
          "type": {
            "type": "string",
            "minLength": 1,
            "description": "Kind of evidence: test_result, screenshot, log, build_log, diff, spec, etc."
          },
          "ref": {
            "type": "string",
            "minLength": 1,
            "description": "Path to the evidence file, relative to the run directory."
          }
        },
        "additionalProperties": false
      },
      "description": "Evidence items backing the claim."
    },
    "reasoning": {
      "type": "string",
      "minLength": 1,
      "description": "Short reasoning note explaining the agent's decision."
    },
    "timestamp": {
      "type": "string",
      "format": "date-time",
      "description": "ISO 8601 timestamp of when this proof was created."
    }
  },
  "additionalProperties": false
}
