{
  "agent": "planner",
  "task_id": "T-00",
  "claim": "OpenAPI specification and brief analyzed; structured plan and user flows generated.",
  "evidence": [
    {
      "type": "plan",
      "ref": "C:\\Users\\jayant\\Documents\\College\\Labrith\\docs\\evidence\\planner-llm\\plan.json"
    }
  ],
  "reasoning": "Parsed OpenAPI endpoints (/api/tickets, /api/tickets/{id}, /api/tickets/{id}/reply) and brief. Structured into two responsive pages with 5 sequential cross-functional tasks mapped to QA flows.",
  "timestamp": "2026-10-13T16:38:06.870614+00:00"
}