{
  "agent": "critic",
  "task_id": "T-05",
  "claim": "Build accepted: 0 critical/serious axe violations; Lighthouse accessibility 100.0, performance 98.0.",
  "evidence": [
    {
      "type": "audit_report",
      "ref": "C:\\Users\\jayant\\Documents\\College\\Labrith\\docs\\evidence\\critic\\artifacts_accepted\\T-05\\audit_report.json"
    }
  ],
  "reasoning": "Audited application with axe-core and Lighthouse. All accessibility standards satisfied with 0 critical or serious WCAG violations. Quality metrics exceed thresholds.",
  "timestamp": "2026-10-14T05:34:19.398340+00:00"
}