{
  "agent": "designer",
  "task_id": "T-01",
  "claim": "Revised design tokens resolving 1 critic finding(s).",
  "evidence": [
    {
      "type": "design_spec",
      "ref": "C:\\Users\\jayant\\Documents\\College\\Labrith\\docs\\evidence\\designer\\T-01\\design_spec.json"
    }
  ],
  "reasoning": "Updated design tokens based on critic audit findings. Recorded 1 revision rationales.",
  "timestamp": "2026-10-13T19:06:45.402542+00:00"
}